label,text,num_chars
rec.sport.hockey,"the hawks won the norris div, and sealed their fate. its bad luck to win the norris. the hawks will sweep the blues in their dreams but will lose in in reality. i predict that in the game with the blues belfour will go down on his knees time s and will spend the rest of the time looking behind him self. butcher will pound roenick and the warthawks have no one tough enough to prevent it",388
talk.politics.mideast,"all humans suffered emotionally, some jews and many others suffered physically. it is sad that people like you are so blinded by emotions that they cant see the facts. thanks for calling me names, it only assures me of what kind of ignorant people i am dealing with. i included your letter since i thought it demonstrated my point more than anything i could write.",364
rec.sport.hockey,"just a side note, squidoctopi made their way to the ice in buffalo. i still dont understand why buffalo, but maybe its lucky. btw, they shovel them up from the ice here, using the shovel used to scoop up the snow the zamboni leaves as it leaves the ice. although blue did give some technical directions on its removal, motioning with his stick.",344
talk.politics.guns,"no chance. if that cs ignited at all, it would have been quite similar to a grain bin explosion. explosion, i note. the entire compound would have been leveled, not merely burned. as there was no explosion, there was no cs ignition causing the fire. note at five miles a decent grain elevator explosion will knock you on your butt and your ears will ring for days. i speak from experience here.",394
talk.politics.guns,"in the latest case in denver, they were giving away tickets to a denver nuggets basketball game. how traceable is a money order? i dont know. havent used one in years is that even an issue if the weapons arent checked for being stolen?",235
rec.sport.baseball,"since someone brought up sports radio, howabout sportswriting??? anyone give an opinion which city do you think has the best sports coverage in terms of print media? these are general questions is the washington post better than the philadelphia inquier or the ny times? howabout the philadelphia daily news compared to the new york daily news?",344
talk.politics.mideast,your ignorance is obvious from your posting. cyprus was an independent country with turkishgreek inhabitants not a greek island like your ignorant posting claims the name should be cyprus in english next time read and learn before you post.,240
rec.sport.hockey,"john girash writes. you can get wjr a long way away. the problem is that, because of those well known and beloved contractual obligations, wjr will be doing tiger baseball instead of the wings playoff games for probably half the games the wings could play. for this series, i know tonights game and i believe games and if necessay will be bumped. ron",350
talk.politics.mideast,"while one may question the motives of the arabs who sold land to jews, often while publicly criticizing the sale of land to jews, it was the jews and not the arabs who were taken advantage of, as the prices the jews paid for barren land was many times the price fertile land was being sold for in the united states at the same time.",332
rec.sport.baseball,"the royals are darkness. they are the void of our time. when they play, shame descends upon the land like a cold front from canada. they are a humiliation to all who have lived and all who shall ever live. they are utterly and completely doomed. other than that, i guess theyre ok.",281
talk.politics.guns,"id bet cash of the people couldnt find the window after six minutes! ask anybody whos taken basic training in the military. it is not at all uncommon for a few soldiers who have not properly attached and cleared their masks to require assistance exiting the chamber. since that chamber has a door, not just a window, its likely a hell of a lot easier to exit than a multiroom, damaged house.",391
talk.politics.guns,"james, it could be that they were determined to stay together in the compound no matter what happened. perhaps the fire was accidental, and the db simply refused to leave the compod. perhap they died fighting the fire? who knows. we will have to wait and see. i persaonlly find it hard to believe that they would all agree to burn themselves up! what a horrible way to go.",372
talk.politics.guns,"pprunaugust.it.uswc.uswe unites states senate washington, d.c. the house of representatives washington, d.c. the white house washington, d.c. seth unlike cats dogs never scratch you when you wash them. they just become very sad and try to figure out what they did wrong. dave barry",281
rec.sport.hockey,"hi all, i dont get the sports channel and im desparate for some playoff action especially the cannucks. does anyone know of a sports bar on the bay peninsula that will be showing hockey games. im looking for something between redwood city and mountain view.",257
talk.politics.mideast,"why retract your accusation that hes a liar? if omran retracts his verbal diarrohea doesnt that only prove the liar he really is? a retraction would be pointless! giving this guy the opportunity to save face after uttering such bullshit would just encourage him to do it again! i must say that your style is very impressive, mark. keep it up! mike",347
talk.politics.guns,ive yet to meet a group of baptists who were stockpiling cambells soup and msars and bangingmarrying thirteen yuear olds. youre a sorry son of a bitch if you cant draw a distinction between these two things. people like you cheapen our constitution by using it to defend sociopaths who arent deserved of it. get a life and chill on the paranoia.,345
rec.sport.baseball,i think lamont is tryin sax out in left because he is messing with his mind. he is trying to stir loose the mental block that he has had. sax was supposed to play in left last night but we were rained out. its not like we need to add any more outfielders to our team. its mental,278
talk.politics.mideast,"if ownership were rightly based on worthiness there wouldnt be any owners. what is your point? as i understand it, israels claim on jerusalem is based on possession, and the absolutely central not second, not third role it plays in jewish identity.",248
rec.sport.baseball,"i grew up listening to harry carey call the cardinals games and really liked himthen. but, as i recall, he was fired because he was too critical read honest when he was announcing. he dared to point out the cards miscues and such. at least, this is what i remember from when i was a kid.",287
talk.politics.guns,"oh, i see. electricity is a natural right our wonderful government would never cut off the power to the people they were besieging. are you really this dumb, or just acting like it for the sake of argument? jason",212
rec.sport.baseball,"dont knock vaughn for being a spring training . hitter but a . regular season hitter. around games played isnt an indication of how good any hitter is, and the quality of pitching is way down. ryan robbins penobscot hall university of maine",240
talk.politics.guns,"please take this thread out of tx.politics.talk.politics.guns which does not exist. how about tx.politics,talk.politics.guns instead, eh? ed mcguire lbj freeway, suite systems administrator dallas, texas member of technical staff , fax intellection, inc. edintellection.com",273
rec.sport.baseball,"perhaps so. i was only responding to the yankees of the s and s part of the comment. if those teams were a sure thing and lost, then its probably not so unreasonable for someone to pick another team not that i did.",214
rec.sport.hockey,"id personally prefer buffaloboston, as a birthday gift from espn, but i dont think the folks at espn will accomodate that for me espn has this inexplicable affinity for the patrick division, it seems.",200
rec.sport.baseball,"deion sanders hit a home run in his only ab today. nixon was for . infield single. deions batting over . nixon around .. whom would you start? wise up, bobby. see yall at the ballyard go braves chop chop michael mule",216
talk.politics.mideast,"timbo, israel has not been recognized as a state by the arabs, except for egypt, of course. isnt that a gesture? what has israel offered? well, it has been calling for peace talks for years, asked for economic relations, and asked for diplomatic ties. what else is there? would you have israel sacrifice its security? nay, i think not.",335
talk.politics.guns,"even if it were a capital offense, the warrant was not even an arrest warrant, but a search warrant. in other words, there was no evidence of illegal arms, just enough of a suggestion to get a judge to sign a license to search for illegal evidence.",248
talk.politics.guns,"the idea of the card is bull in and of its self, but im curious to know, do they plan on making it a requirement to always have it on you, or is it only going to be required to be presented when trying to ge medical aid? btw, anybody planning on shaving hillarys head to look for ? later dave, days goverment logic or just the clintons?",336
talk.politics.guns,g jmaybe they wanted it to look like murder. he had days. i think this was coming the whole time. he didnt even put the children in the buried bus or the underground bunker during the cs seige. he put them up into the tower to die. is cs gas lighter or heavier than air? do you know? if the cs is heavier than air. most chemical weapons are.,341
rec.sport.hockey,"ive been watching playing hockey for a good long time now, and ive seen players with questionable tactics, but never have i seen what ray did on sunday. this guy gets my all time loser award. its one thing to repeatedly cross check someone to the back of the neck when they are down, its another thing to have a fist fight with someones balls. ray should be thrown out of the league, what an ahole.",398
talk.politics.mideast,"arab citizens have the all the same rights as jews. arabs are exempt from military service, but that is about it. arabs have a full voice in israeli politics, to the degree that they choose to get involved. they may vote. there are arabs in the cabinet.",253
rec.sport.baseball,"why? do you expect him to remain the best shortstop in the game until he reaches his seventythird birthday, or something? why is it such a strange concept that a fortyoneyearold ozzie smith might be a defensive liability in ?",225
rec.sport.baseball,"i wish i hadnt sold my copy of jewish baseball stars. its a short shelf i.e., the one on top of the toilet tank special. the writing in that books is so astonishingly awful every sportswriting cliche taken to the nth degree and then mangled that its funny. rusinow is the author, i think.",288
rec.sport.baseball,". . . since i was born in the late pleistocene, i too remember . that year, the dodgers were several games out of first and i think finished sixth in the league. this was kind of odd because they won the world series both the previous year and the following year. warren usui",275
rec.sport.hockey,has anyone heard what game espn is showing tonight. they said they will show whatever game means the most playoffwise. i would assume this would be the bluestampa game or the minnesotared wings game. anyone heard for sure???,224
talk.politics.mideast,"q when an israeli pilot is bombing school children in lebanon gets shot down, and crashes headfirst, whats the last thing that goes into his mind head? a his butt hole. now this has to count as one of the most original and constructive contributions yet on tpm. all in all, well worth the it took to send it to thousands of computers all over the world.",353
rec.sport.hockey,"bufflo sabres has just finished their great four wins over boston. all sabres players contribute to those great wins but those talent players including mogily, fuhr, kemhlev and lafontin impressed me most. their skills showed the art of sport, not like the garbage speech from the coachs corner.",295
rec.sport.hockey,"hmmm.i also heard through the grapevine that team finland might try and leave a spot open for at least one nhler. some guy named selnne, ever hear of him? they might have to be content with kurri, though, i hope.",212
talk.politics.guns,"please note that my above comment was not intended as a flame of kens call for congressional leadership to conduct a proper investigation. it was merely to call attention to the hazard of having specter involved. if anyone took it that way, i apologize.",253
talk.politics.mideast,"the question is by going east or west from the misisipi. on either choice you would loose palestine or broklyn, n.y. i thought youre gonna say fromn misisipi back to the misisipi ! lets say lets establish the islamic state first or lets free our occupied lands first. and then we can dream about expansion, mr. gideon",317
talk.politics.mideast,"already say it the other week on cbc snoozeworld yeah, i thought bonanza was full of lies about the west. why the hell would such an oil rich and hydroelectric potential to be exploited spend billions on a nuclear energy programme? yeah, and we have every reason in the world to trust the iranian regime. after all, theyve been so forward with us in the past.. maybe he is god!",377
rec.sport.baseball,"could someone out there send me pecotas stats for the last few years, or something to give me some sort of feel for what kind of player he is? my mind has no handle on him at all, it bothers me. pecota of the braves, that is. pretty meaningful that i cant even come up with his first name, i think..",299
rec.sport.hockey,"i cant let this pass. if the islanders get past pitts. assuming the isles beat the caps, god willing, them im sorry, the isles will crush the leafs. flame shields up. of course no one asked me i always interject my opinions on matters i have no concern over go islanders!!!!!! down, to go go jets for",300
rec.sport.hockey,"i have one complaint for the cameramen doing the jerseypitt series show the shots, not the hits. on more than one occassion the camera zoomed in on a check along the boards while the puck was in the slot. they panned back to show the rebound. maybe moms camera people were a little more experienced.",299
rec.sport.baseball,"this list brings to mind possible the worst trade since babe for nono nannette, i.e., milt pappas for frank robinson, i think in ?. robinson proceeded to win the triple crown in and may have beaten out yaz in but was injured on a slide into second when he collided with the mighty al weis chisox.",296
rec.sport.hockey,"you must be kidding, right? in losing stevens the blues got shanahan and kept joseph. then they traded oates for janney. as a hawks fan you have got to respect those hapless names. lets see, who scored the game winning overtime goal in the th game???",250
rec.sport.hockey,i am curious to known if there are any professional sports teams whose games are regularly broadcast on an fm station. the only one i am aware of is wysp in philadelphia who carries the eagles games. if you respond to me i will summarize for the list.,251
rec.sport.baseball,"i am looking for a source of american league baseball stats for individual players in the same format as printed in newspapers, ie. i do not want to provide a list of players and get back nice printed reports for a week. does anyone know of such statistics availability and an idea of the cost?",294
talk.politics.mideast,"anas, of course ! the yahud needed blood for the matza. after all, passover was last month why dont you give us your national geographic travelogue of your recent trip to palestine ? or are you too disappointed by what you saw ? josh backonvms.huji.ac.il",254
talk.politics.mideast,"freedom of speech does not mean that others are compelled to give one the means to speak publicly. some systems have regulations prohibiting the dissemination of racist and bigoted messages from accounts they issue. apparently, thats not the case with virginia.edu, since you are still posting.",294
talk.politics.mideast,"in resyrias expansion, the author writes that the un thought zionism was racism and that they were wrong. they were correct the first time, zionism is racism and thankfully, the mcgill daily the student newspaper at mcgill was proud enough to print an article saying so. if you want a copy, send me mail.",304
talk.politics.mideast,"thank you very much for clarifying your position and source. apologies are accepted in good faith. this absolutely was no attempt to bring you to your knees, it is merely a suggestion to really check and resheck your sources before throwing a flame into the net. thanx again",274
rec.sport.hockey,the french canadian rule was an extremely short term feature when the universal draft was instituted in the sixties and only lasted for a few years.and really didnt have any substantial effect during that period. the canadiens stanley cup achievements were earned on a level playing field.,289
talk.politics.guns,because most of the children were with their parents. do you understand that concept? heres a bunch of people who believe in their minds that the forces of satanic evil are outside and you expect them to hand over their own children? were you born that stupid or does it take a lot of effort?,292
rec.sport.baseball,"rogers is the onebatter lefty in the bullpen. dusty has also said he trusts rogers to get the final out in a ballgame where beck is unavailable, so you might see a couple of saves for kevin. then again, if any of the regular rotation falters, rogers is a possible candidate to start, though this would appear less likely now that dave burba did well in an emergency start.",372
talk.politics.mideast,"from a recent interview in middle east insight magazine, clinton said that he supports moving the us embassy to jerusalem, but would not do so at this time because it would interrupt the peace talks. msilvermnyx.cs.du.edu go cubs!!!",232
rec.sport.hockey,"ok, but have you seen tabaracci play yet? in his two starts and his relief effort for beaupre, he has looked mighty sharp dont forget the shutout. i think hes let in just four goals over eight periods of play. i like hrivnak, but we might actually have to give some credit to david poile for a change after this trade. hopefully if tabaracci starts against the isles tonight, i havent jinxed him.",396
rec.sport.hockey,"marcus thuresson had goals, assists, points and pim in games this season for leksand in the swedish elite league. this was only th in point scoring for leksand. marcus born may , ht cm, wt kg is relatively young so he might still start producing, but i think the sharks may have done a bad trade here. staffan",309
talk.politics.guns,"do you have any statistical evidence to back you claim that requires another limitation of the citizenry freedom? steve podleski phone nasa lewis research center cleveland, ohio email pspodhooch.lerc.nasa.gov",208
talk.politics.mideast,"while you brought up the separate question of israels unjustified policies and practices, i am still unclear about your reaction to the practices and polocies reflected in the article above. tim not a separate question mr. clock. it is deceiving to judge the resistance movement out of the context of the occupation.",316
rec.sport.hockey,"ahl playoff scores first round home team in caps games played on tues, rochester utica fredericton at cape breton series stati plural of status? adirondack leads cdi, providence tied wspringfield, binghamton tied wbaltimore, rochester leads utica, st johns leads moncton, cape breton tied wfredericton,",302
talk.politics.guns,"speaking of the sick bastard, i noticed he attends kent state university. i guess we have come full circle here. someone from kent favoring excessive force by the govenment to subdue polically incorrect thinking.",212
rec.sport.baseball,"hey guys, who is this jack morris fella ?????? only joking !!!!! but try to lighten up will ya ? the seasons only just started and everyones apoplectic. if all you statheads out there are trying to justify how morris is doing at the moment, just remember that were talking about a very small sample size. there is a helluva long way to go, so sit back and enjoy the ride.",371
rec.sport.baseball,"and they deserve to be, if for no other reason than salvaging a little of the honor of the nl west. the supposed strongest division in baseball lost of to the east yesterday, with only the astros prevailing. we will stretch no farm animal beyond its natural length paulakoufax.cv.hp.com paul andresen hewlettpackard",315
rec.sport.baseball,"yes, i could look it up but i prefer to post this question to the net. i read somewhere in a long forgotten article that the handsignals used by major league umps were originally used to help a deaf ball player by the name of dummy. urban myth? true? i gots ta know.",266
talk.politics.guns,good point about registration schemes being used only for harassment deleted i would also like to point out that this is receiving stolen property and is no different than a pawn shop owner doing the same thing.,211
rec.sport.baseball,"ive a curiousity whenever a person is put on the day, day or day, the person is on the list longer than the specificed time ive seen a person on the day for maybe months last year, i dont remember what. i just need a little clarification on the disabled list specifications. scotyy",281
talk.politics.guns,"aw, gee, and whose fault is that? dear, dear. they could have come out. dear, dear. they could have come out. the gas began filling the air, it couldnt have gotten too heavy with all that wind blowing through. scattered throughout the house, the cult members made no efforts to sad, but they could have come out.",312
rec.sport.hockey,"only problem is that zombo was traded to st. louis last year for goalie vincent riendeau. i think that while chevy is not among the elite class of goalies, he is adequate given the offensive firepower of the wings.",214
rec.sport.hockey,"w w see! the providence bruins lost the first two games at home and came back to w tie the series on the road, there may be hope for the bruins yet! toast. theyre toast. and i know how much you want me to eat these words, but it aint gonna happen. are the golf courses in the boston area in playable condition yet? jack acid consumes times its weight in life!",359
rec.sport.baseball,"despite walks and loses, ryan deserves to be in the hall of fame imho based only on his hohitters. the strikeout records are an extra. what do people think about andre hr dawson for the hof? name ken kubey or qb reading, editing or printing of this text address kubeysgi.com without the express written consent of disclaimer the usual major league baseball is prohibited.",371
rec.sport.hockey,"obviously, it is ultimately the teams choice.the nhl would obviously prefer not to annoy the european hockey federations, but the nhl right now cannot force nhl teams to free their players.the whalers probably did it this way so as to not annoy their farm team affiliate.",271
talk.politics.mideast,i was trying to avoid a discussion of the whether clintons views should be endorsed or not. all i was trying to find out was whether the newspaper article was correct in making these statements about the president by obtaining some information about when and where he made these statements. thank you.,301
rec.sport.hockey,"centers . . sanderson will be on team canada, but hed be out of position as a center. although he was drafted as a center and played there as a rookie, sanderson scored goals this season as a left wing.",202
rec.sport.hockey,"speaking of roger and ilk, whatever happened to good ol gln? i had him in my kill file since last years playoffs and now that ive moved to a new news reader which doesnt have kill files, i find that hes gone. i must admit, however, that unlike gln, roger seems to know something about the game as long as the subject doesnt touch on the leafs.",343
rec.sport.baseball,"dunno about miller. if you mean scott erickson, currently the reigning twins least consistent good player, he pulled a muscle in the neighborhood of the rib cage that made it essentially impossible for him to pitch temporarily, and is expected back on the mound sunday.",269
rec.sport.baseball,"as the heading indicates, it is impossible for me to fathom why barry is not batting th for the giants behind will clark. barry is such an awesome and consistent hitter definitely the best in the national league. imho, to have williams, a streaky hitter and not really a clutch hitter batting th ahead of bonds is simply an injustice to the giants and fans of the giants.",371
rec.sport.baseball,boston at seattle boston ab r h bi seattle ab r h bi riles b felder lf quintana rf cotto dh greenwell lf sasser ph dawson dh griffey jr cf m vaughn b buhner rf calderon cf boone b cooper b t martinez b john valentin ss blowers b pena c valle c vizquel ss totals totals,268
rec.sport.baseball,"briefly, since im off to sleep. mles work pretty well for aa nd aaa players. players who are and younger will tend to have explosions in their numbers, whether mmles or not, in the next years. players who are and older, at those levels, generally have inflated mles. theyre about as reliable as having major league stats for a player.",334
rec.sport.hockey,"well, your majesty, , couldnt you just picture it? cherry starts doing his first postgame interview with barrasso tommy gives him that little look like somebody crapped on his shoe and then proceeds to give don a tonsilectomy with his sherwood. now that you could put on payperview! hope you had a good laugh!",309
rec.sport.baseball,"a month? well, he did have a short careercompared to what one might have expected for such a highly touted prospectdue to being injury prone, overweight, and having no work ethic. but he certainly did not suffer from being rushed to the bigs.",242
