label,text,num_chars
talk.politics.mideast,i understand how israel captured the teritory and feels that it is its right to annex it. i cant fully understand why it has to deal with palestinians much the same way jews were treated before the holocaust the final solution by hitler. what i totally dont get is why the u.s. has to subsidize the existance of such a thorough abuser of human rights. just wondering,366
talk.politics.guns,"and im sure that is a great comfort to the widows and children of those stabbed, beaten and burned to death. the real question is, did the crime rate in england go down, after they enacted gun control laws? if you look at the rates before and after their first such law in , you will see no effect.",298
rec.sport.hockey,have a look at ed belfour. belfour kicked gerrard gallant when the wings played the hawks a couple of weeks ago. no penalty. no review. no suspension. this was after he attacked bob probert in the previous period. he was penalized for that. likewise belfour. too bad he goes down so much!,288
talk.politics.mideast,"deleted its noteworthy that the posts about the west being evil etc are made not in some islamic hellhole but from the west. if the west is so bad, why do they come here? notice how they comfortably exercise their rights to free expression, something completely absent in their own countries. vasudev",300
rec.sport.baseball,"recently, i heard the red sox on wrol a spanishspeaking radio station. i thought it was so unreal. the red sox in spanish? anyway, i want to find out how widespread this is? being a ny native, i know the scmets are on in spanish but not the yankmes. i wuold think that la,sd,texas and fla are on in spanish. are there any spanishspeaking networks or is this a local",365
rec.sport.baseball,"this talk about the phillies winning the nl east is scary. very scary! dont get me wrong, im a phillies fan but as late as last year they looked helpless. the funny thing was they did have a lot of injuries in spring training that basically killed their chances. of course, dont forget the dykstra wrist injury in the first or second game?",339
talk.politics.guns,"which article of the constitution gives me the right of revolution if things seem to be going cockeyed?? hmmm. peter g. white, president, synthesis inc. milwaukee, wisconsin, u.s.a. peter.whitemixcom.com",203
talk.politics.guns,"you forgot the part about encasing it in a small shaped charge so that if anyone tries to tamper with it, it explodes and kills you. oh, and the shaped charge can be set off by remote control.but only if you get out of line. properly patriotic citizens have nothing to fear.",274
talk.politics.guns,"but they also might have run out of firewood maybe chopping up furnature?. they also may not have been cooking, but eating mres and other delicacies stored for just such an occation. just a thought. brent yes i am well aware that their electricity was cut, thanks to the hundreds of email messages and replies to my post irvine",327
rec.sport.baseball,"if you think thats bad, just wait until he tries dunston in the leadoff spot again. yes, i also wonder if they can win with this manager. i never believed managers had that much to do with winning until i saw how much they had to do with losing..",246
rec.sport.hockey,"actually, messier was invited, but declined due to nagging injuries. keenan and messier have always gotten along.keenan dumped steve yzerman from the last canada cup team, even though yzerman had endured the training camp, when messier who had missed essentially the entire camp recovering from injuries became available at the last moment.",340
talk.politics.guns,"are you for real? people dumb enough to give their money and possessions to a guy who says hes jesus deserve all they get anyway, he killed a few feds hes not the goddam hero here hes dead an im happy!!!!!",205
talk.politics.mideast,"this post has all the earmarks of a form program, where the user types in a nationality or ethnicity and it fills it in in certain places in the story. if this is true, i condemn it. if its a fabrication, then the posters have horrible morals and should be despised by everyone on tpm who values truth. jesse agreed.",316
talk.politics.guns,"well, it seems we dont learn the lessons of history do we? i was hoping that kent state taught us a lesson. apparently not. apparently the government will murder anyone they choose to still. rawlin blake blakenevada.edu",219
rec.sport.hockey,"capsisles fans, anyone interested in catching the games from nassau coliseum hopefully there will be another can catch the game at north carolinas original sports bar in chapel hill. im pretty sure they carry hts as well. they had all three games on at the same time last night. this is the only place i know to catch all of the stanley cup action.",348
talk.politics.guns,"good now lets look at those sections. theyll prove my point. note that this doesnt affect all concealed carry. look after the word except. it always helps to read the law before commenting on it. would a prudent storekeeper carry concealed? how about someone at home? note that both are legal, and a lot of common people qualify for one or the other. andy",355
talk.politics.guns,"so could the defenders in the alamo. youre clearly missing the point here. typically, i might add. if it were me, i doubt that i would have come out. batf show up, start shooting at me, etc. then they paint me a childmolesting murdering fanatic, call up tanks, hundreds of automaticarmed goons. restrict press access to two miles away.",335
rec.sport.hockey,"in qvosrcl.msu., vergolineuler.lbs.msu.edu david vergolini writes. theres quite a few wings fans lurking about here, they just tend to be low key and thoughtful rather than woofers. i suppose every family must have a roger clinton, though. but remember to paraphrase one of my favorite star trek lines, if we adopt the ways of the leaf fans, we are as bad as the leaf fans. ron",377
rec.sport.hockey,"the problem is that by no fault of espn ongoing games are not covered til the final horn sounds. with two channels, scny and sca, latefinishing games up to pacific time and overtimes elsewhere will kick in at the end of local coverage. if scny is blocked by the mets, there is still some hockey on sca scny plus. with an espn , the current situation would be alleviated. gld",374
rec.sport.baseball,"i believe si had an indepth article on moe a while ago. i remember that the article revealed some new facts regarding the secretive moe. my si subscription expired this past february, the second of two years that i received same. therefore my guess is that the article appeared sometime in . can anyone else be more definitive as to a date of the si article ?",359
talk.politics.mideast,"dear pete, for one who is so zionist as you, you should at least know your hebrew, young man. the last sentence in your posting should read medina achat leshnai amim not echad medionnot leshtai amim. i dont want to address your comments. they speak for themselves. best regards from a palestinian of jewish origin who talks, reads and writes hebrew and does not hate jews nor anybody else.",389
talk.politics.mideast,"ok, someone is fundamentalist, someone else is not. what defines a fundamentalist not who!!!!!!!!!. that is an essential question which nobody has agreed upon an answer, at least to what literature discussion news ive seen..",224
rec.sport.baseball,"i remember one he hit circa at wrigley field that went across the street in dead center field and hit a house on the roof. he whiffed a lot, but when he did connect, watch out! include stddisclaimer.h",200
rec.sport.hockey,"wood played most of his junior career in seattle. he was one of the leading scorers on a mediocre team when he was traded away in . he rarely lost a fight and was one of the toughest players in the whl. however, i was extremely surprised when he was drafted, especially in the third round. he certainly didnt look like nhl material.",332
rec.sport.baseball,"not to mention that lankford had been hurt two nights before running into the outfield wall. this being the reason he was available to pinch anything. his ribs were the problem so he could run but not hit. torre is no white rat but give him credit for what he is , a pretty darn good manager. with the exception of the felix fiasco, but im not sure whos brainchild that was. bil",378
talk.politics.guns,"ive been running a daily summary of the randy weaverkevin harris trial from here in boise. these summaries are sent primarily to mailing lists. however, i was wondering if people would be interested in seeing them here. post or email. drew",239
rec.sport.baseball,"heres an easy question for someone who knows nothing about baseball. what city do the california angels play out of? richard j. rauser you have no idea what youre doing. rausersfu.ca oh, dont worry about that. were professional wni outlaws we do this for a living.",264
rec.sport.hockey,"have the rules for goalies equipment changed? it seems that e.g. glove has become bigger and bigger all the time and pads too, and the goalies are wearing over size jerseys. am i dreaming? if you watch old photos or films let say about ten years back, i think the difference is quite obvious. who is an expert on this, please let me know. or have the goalies become bigger?",373
rec.sport.baseball,"the answer is theyre stupid. seriously, i think youre right on the money ive never understood the preoccupation with making sure a rotation has lefthanded starters. the only time it makes sense to me is when you have an unbalanced schedule and your main rivals is loaded with lefthanded hitters. other than that, i think youre completely right.",344
rec.sport.baseball,can anybody figure out why some box score abbreviations make absolutely no sense? at least in the local gannett rag that finds its way to my door. i must have stared at cleman in the mets box for a good seconds this morning wondering who the hell it was. wouldnt it make more sense to use colemn?,296
rec.sport.hockey,". with soderstrom and roussel, why the hell would the flyers want to pick up an older and slumping roy? byw, i could come up with a group of players theyd trade for.. but they wouldnt be from the same team.",206
talk.politics.mideast,"according to the ny times, the islands belong to the united arab emirates. why is it, then, that when the british, iranians and uae refer to occupied territory, they mean territory in dispute in israel but not in their own affairs?",231
talk.politics.guns,"from article hydra.gatech.edu, by gsprism.gatech.edu glenn r. stone i second that motion wholeheartedly. also, how about stcanning the cigarette cops a.k.a. as the atf. comments anyone? scott kennedy, brewer and patriot",219
talk.politics.mideast,"so was it on cnn or not? what proof. you said above was it not reported. and someone please give full details if they can remember. hear say is not proof. yes, like the or more palestinians brutally murdered by their brothers.",226
talk.politics.mideast,". maybe im a bit oldfashioned, but have you heard about something called love? it used to play some role in peoples considerations for getting married. of course i know some people who married fictitiously in order to get a green card, but making a common child for ,? the power of aa is limited. your proposal is indeed unconventional.",336
talk.politics.guns,"unsealed, it is clear that clinton and reno supported an illegal raid. did they not know this? no authority to use helicopters. sorry, i missed all this! can you please give an update on the warrant? i hadnt heard that it was unsealed. there was no authority for a noknock? this is news. how about an ok for a wiretap?",318
talk.politics.mideast,"the wars of , , , were definitely started by the arabs. the war in was instigated by the arabs who continually murdered israeli children with their rocket attacks. israel was only trying to stop this. last what the heck are you talking about with karama? there was no war in ! steve",282
talk.politics.mideast,"the american press routinely uses the word fundamentalist to refer to both christians and jews. christian fundementalists are often refered to in the context of antiabortion protests. the american media also uses fundamentalist to refer to jews who live in judea, samaria or gaza, and to any jew who follows the torah. adam adam shostack adamdas.harvard.edu",357
talk.politics.guns,"firearm? lets not even consider long knives swords, which were also common militia weapons in the th century, and which, if anything, are often restricted more heavily than firearms. whatever sense gun control makes, knife control makes even less.",247
talk.politics.guns,"with one exception, thats a pretty good description of many of the baptists i know. the exception is that they know the difference between an m and an ar. heck they even know that it looks like richard pettys stock car doesnt mean its a racing stock car. they may be uncouth, but theyve figured out that appearance isnt function. andy",334
rec.sport.hockey,"i cant believe sht like this gets any attention in this group during the playoffs. ali,youre a blabbering moron. at least you couldve waited till the end of the playoffs to start your dumb letter campaign.",205
rec.sport.baseball,"but maybe his wife was i dont claim to know whether its true or not, but a couple different people totally unrelated have said harry was relieved of his duties because he had more than platonic relations with augie buschs wife. judgement is left to the individual, cuz i sure dont claim to be an impeachable source in this case.",328
talk.politics.guns,"much of the dispute about the origin of the fire that destroyed the bd compound could be settled by examining the propane tank supposedly crushed by one of the army tanks when they breached the walls of the compound. if the the propane tank is flattened and has tread marks on it, then the bds version of the cause of the fire would seem to be verified. dave feustel nmyi feustelnetcom.com",389
talk.politics.mideast,"from article apr..src.honeywell.com, by amehdisrc.honeywell.com hossien amehdi tell me then, would you also fight the syrians in lebanon? oh, no of course not. they would be your brothers and you would tell that you invited them.",229
talk.politics.guns,"excerpts from netnews.talk.politics.guns apr the dayton gun buy back .. by larry ciprianicbnews.cb progun people can take used potmetal guns with sale values less than . and turn them in, thus making a profit at the gungrabbers expense. seth unlike cats dogs never scratch you when you wash them. they just become very sad and try to figure out what they did wrong. dave barry",376
rec.sport.baseball,"i laugh at you now, and i will laugh at you again, equally publicly, when the jays finish third due to the severe depletion of their talent. i think bill james put it best about sparky anderson, abstract there are a million guys in this country with great attitudes, but there are only about five hundred who can play a major league brand of baseball which are you going to take?",379
talk.politics.guns,"hey! if you can get it together, im all for it! i too am one of the poor a college student get a bank account set aside, and set aside a big ass data base and you will get my contribution. im setting aside as of now a month. not a slew of cash to be sure, but its the best i can do. let me know what you guys come up with. im sure as hell not going anywhere.",358
rec.sport.hockey,"lori, the regular penguins poster here on rec.sport.hockey, indicated to me via email that on the nights that pirates baseball and penguins playoff games coincide, the pens will be covered on wdve fm ..",202
rec.sport.hockey,"the hawks win!! jermey roenick scored his th goal and the hawks put the leafs in their place, the losers column. if the leafs can not even beat the hawks in a match that had little or no meaning i will hate to see them against the wings. oh btw i laugh at rm, that jerky!!! go hawks!!!",285
rec.sport.baseball,"well, they just said that franco will probably go on the dl tomorrow. they mentioned a career minor leaguer as the warm body who would go along.i forget. also, when answering questions about the rotation, coleman sd broadcaster said that hurst is gone in about a monthmonth and a half, which is when he should finish rehab. later dennis",336
rec.sport.hockey,"just curious, roger, but since you have such a vast knowledge of the game and the league, how come you havent made a living out of it? there must be a lot of demand for expertise in the field. im sure youd be of great help to, say, the leafs as an assistant coach or a scout. or maybe try a career as a reporter or tv commentator. i might be wrong, of course, and you already have.",381
talk.politics.guns,he meant the us spends more per capita on guns than canada which isnt really surprising because we were so busy protecting the western world from the ussr that all other countries could slack off on their defense spending.,222
rec.sport.hockey,"hmmmm, im not sure this is true. according to mike lang and good old stagie, along with the rest of the tv crews in pittsburgh, they winning streak could have stopped because it is a regular season mark. i would think this would also hold with an unbeaten streak for regular season games.",288
talk.politics.mideast,"the imposed it knowing that serbia has a stockpile of weapons, and that bosnia will have next to nothing to defend itself. many experts predicted a massacre as early as march, , but the security coucil knew what it was doing. ... .. .. . ..",240
rec.sport.hockey,"messier was not invited due to his nagging injuries. while the press made an issue of it, and attempted to link it to the rangers internal political woes, mike keenan repeated that to messier personally during the msg press conference. it makes sense . messier would probably have not declined the invitation if it were made for publicity . gld",344
rec.sport.baseball,"their phone number is . the last catalog shows three oaks jerseys home, home, home theyre each .. all their merchandise is handmade and is an authentic replica. i own a couple and they are excellent. they also have wool caps and jackets. you should call to get on their mailing list even if you cant afford their prices.",320
talk.politics.guns,"is this a joke? the legal way to serve a search warrant is to knock on the door. tossing in a grenade to serve a search warrant violates the us constitution and is hence, illegal. the bd complied with legal search warrants in the past. i do not understand why the batf used an illegal means to serve their search warrant last february.",335
talk.politics.guns,"this is really uncalled for. you cannot expect a european, growing up in a culture of rulers and subjects, to immediately grasp the concepts of individual independence and citizen sovereignity in the us. hes less at fault than the countrymen we have here who also cant grasp it.",278
rec.sport.hockey,"speaking of paddockwhats he doing slagging sandlak? if sandlak puts his mind to it, he can be a physical presence and waking him up might be a real mistake. isnt sandbag out with an injury now anyways? perhaps paddock meant to say that momesso was the cheap short artist. after all, that would make more sense.",310
talk.politics.mideast,"when someone starts criticizing the leftists for not being leftist enough, we get a pretty clear idea of what they believe to be normal. i hope that your not still calling yourself fair and unbiased, elias.",206
talk.politics.guns,"once upon a time, thats exactly what they would have done everyone could have just gone on living a peaceful if well armed life. what is it that makes people think they have the right not to just leave others be? jason",218
talk.politics.guns,i see no difference between janet renos claim of responsibility for the waco massacre and the iras claims of responsibility for various acts of terrorism against british citizens. dave feustel nmyi feustelnetcom.com,215
talk.politics.mideast,"danhy, as you think bedouin will be surprised by the posted article, i would be happy to have some feedback from bedouin readers, if you will. i cannot judge the accuracy of the article, but assumes that it is no fabrication. any critical review would be helpful.",263
rec.sport.hockey,"i think, as do the owners, that hockey will do well in miami since there is a lot of people from the northeast that spend their winters in florida every year. as for the coverage, someone will have to come up with some money for that since broadcast rights can be expensive! just my .! dale",290
talk.politics.mideast,"damned if you do and damned if you dont! just for the record, egyptian troops were one of the first to be stationed there. i cant remember the exact date but it was late last year. in fact, they lost at least one man there as far as i know.",240
talk.politics.guns,"i think the legal term would be negligent homicide well, its nice to see someone with a brain, a general lack of paranoia, and a willingness to put his thoughts in public. i tend to agree with all you have said. never assume foul motives when stupidity will do. jims corrolary to occams razor semper fi,",303
rec.sport.hockey,"you know. after i finished laughing i thought this would be a great final. two canadian teams with lots of tradition and all that don cherry nonsense behind them and a nailbiter finish. of course, i would prefer a vancouvermontreal final with vancouver scoring the final goal.. pity neither will happen.",303
rec.sport.baseball,"is it just me, or does bichette look totally lost in the outfield? he misplayed martinez flyout into a double against the expos, misplayed alous single into a triple alou tagged out at rd after oversliding the bag and now he misplays another out into a run triple.add in his wonderful batting average and we have one heck of a player!",334
talk.politics.mideast,"the ny times is in error. this is not simply my opinion even the arab sources that i use do not make this claim. this, of course, is assuming that the ny times was refering to the islands that i named above. of those islands, only abu musa has been in dispute and iranian occupation of that island predates the existence of the uae.",332
rec.sport.hockey,the r.s.h faq sheet never fails to crash my newsreader. the only way i can avoid crashing and restarting the machine is to look at the headers and avoid reading the faq. does anyone else have problems reading the faq?,217
rec.sport.baseball,"the defenition of the underdog is a team that has no talent and comes out of nowhere to contend. the mets and orioles are prime examples, not the cubs. sorry, but it is virtually impossible to win a division with no talent over games. well, with players, certainly. however, it is quite possible to win it all with no managerial talent. cf. blue jays, . david",359
rec.sport.baseball,"except for the fact that there seems to be a lot of high scoring al games also and i dont think the expansion teams directly affect them. k. scott day kdayoasys.dt.navy.mil carderock division, naval surface warfare center code bethesda, maryland the point to remember is that what the government gives it must first take away. john s. coleman",342
rec.sport.baseball,"i know, you all were saying ha! the braves score a few runs for maddux, thatll shut that guy up. but no, i think well just keep track a bit longer. last outing runs. total to date runs, games braves record in madduxs starts see ya next time. dennis",248
talk.politics.guns,"i have a joint housesenate conference committe report i.e., crime bill for the rd congress which contains a brady bill day waiting period within it. i believe it just died and never came up for a vote in either house. they got four years of clintons support to pass it.",269
talk.politics.mideast,"poor phill hallambaker. the tremors are getting worse, and his stratospheric typing skills can no longer keep up. spelling flame or real sympathy only his hairdresser knows for sure official mossad policy we dont stop until we get disneyland!",242
talk.politics.mideast,"why? there is no need to go into this... especially this rivetting piece of information. as i remember, someone did ask if uv had a speach code. but, really, there is no need for this brief survey course. how wonderful for you.",227
talk.politics.guns,"only because you are apparently easy to fool. in other words, your remark is obviously from someone who wouldnt know the difference. insisting on perfect safety is for people who dont have the balls to live in the real world. mary shafer, nasa ames dryden",255
talk.politics.guns,on tv news this morning it was reported that the local texas authorities who have reviewed the cases of the children who were released earlier in the siege have found no evidence of physical or sexual abuse of any of the children. i dont recall if this was on good morning america or our local texas tv station.,311
rec.sport.baseball,"why are the red sox in first place? eight games into the season, they already have two wins each from clemens and viola. clemens starts again tonight, on three days rest. whats up? are the sox going with a fourman rotation? is this why hesketh was used in relief last night? hm.",278
talk.politics.mideast,"not according to reports i have read. it seems that the somalis think of our african american marines in less than complimentary terms, using gestures that signify a word i refuse to use. seems that even when you try to help people, they still insult you.",255
rec.sport.hockey,"dont be so sure, the blues played the hawks pretty well this season, and won twice at the stadium. the blues will give the hawks a hard time. this series is one of the best first round matchups, could go either way. the hawks will probably prevail in seven games.",263
